category_name,name,url,status
băng dính điện,Băng keo điện 3M Scotch Super 33+,https://super-mro.com/san-pham/bang-keo-dien-3m-scotch-super-33-.html,0
băng dính điện,Băng dính điện 2cm,https://super-mro.com/san-pham/bang-dinh-dien-2cm.html,0
băng dính điện,Băng dính điện Nano 10Y,https://super-mro.com/san-pham/bang-dinh-dien-nano-10y.html,0
băng dính điện,Băng dính điện Nano 20Y,https://super-mro.com/san-pham/bang-dinh-dien-nano-20y.html,0
băng dính điện,Băng keo điện P.V.C màu đen MPE BKD-20,https://super-mro.com/san-pham/bang-keo-dien-p-v-c-mau-den-mpe-bkd-20.html,0
băng dính điện,Băng keo điện P.V.C màu trắng MPE BKW-20,https://super-mro.com/san-pham/bang-keo-dien-p-v-c-mau-trang-mpe-bkw-20.html,0
băng dính điện,Băng keo điện P.V.C màu xanh lá MPE BKG-20,https://super-mro.com/san-pham/bang-keo-dien-p-v-c-mau-xanh-la-mpe-bkg-20.html,0
băng dính điện,Băng keo điện P.V.C màu vàng MPE BKY-20,https://super-mro.com/san-pham/bang-keo-dien-p-v-c-mau-vang-mpe-bky-20.html,0
băng dính điện,Băng keo điện P.V.C màu đỏ MPE BKR-20,https://super-mro.com/san-pham/bang-keo-dien-p-v-c-mau-do-mpe-bkr-20.html,0
băng dính điện,Băng dính cách điện màu vàng Yato YT-81654 19mmx20m,https://super-mro.com/san-pham/bang-dinh-cach-dien-mau-vang-yato-yt-81654-19mmx20m.html,0
băng dính điện,Băng dính cách điện màu đỏ Yato YT-8166,https://super-mro.com/san-pham/bang-dinh-cach-dien-mau-do-yato-yt-8166.html,0
băng dính điện,Băng dính cách điện màu vang xanh Yato YT-81655,https://super-mro.com/san-pham/bang-dinh-cach-dien-mau-vang-xanh-yato-yt-81655.html,0
băng dính điện,Băng dính cách điện điện 5 màu Yato YT-8156,https://super-mro.com/san-pham/bang-dinh-cach-dien-dien-5-mau-yato-yt-8156.html,0
băng dính điện,Băng dính cách điện điện đen Yato YT-8165,https://super-mro.com/san-pham/bang-dinh-cach-dien-dien-den-yato-yt-8165.html,0
băng dính điện,Băng dính cách điện màu xanh dương Yato YT-81651,https://super-mro.com/san-pham/bang-dinh-cach-dien-mau-xanh-duong-yato-yt-81651.html,0
băng dính điện,Băng dính cách điện màu xanh lá cây Yato YT-81652,https://super-mro.com/san-pham/bang-dinh-cach-dien-mau-xanh-la-cay-yato-yt-81652.html,0
băng dính điện,Băng dính cách điện 10 cuộn nhiều màu Yato YT-8173,https://super-mro.com/san-pham/bang-dinh-cach-dien-10-cuon-nhieu-mau-yato-yt-8173.html,0
