category_name,name,url,status
Kéo cắt tôn,"Kéo cắt tôn kiểu Mỹ Asaki AK-0330 10""/250mm",https://super-mro.com/san-pham/t4110-keo-cat-ton-kieu-my-asaki-ak-0330-10inch-250mm.html,0
Kéo cắt tôn,"Kéo cắt tôn (thẳng) Asaki AK-0335 10""/250mm",https://super-mro.com/san-pham/t4114-keo-cat-ton-thang-asaki-ak-0335-10inch-250mm.html,0
Kéo cắt tôn,Kéo cắt tôn mũi cong trái Toptul SBAC0125 248mm cán đỏ,https://super-mro.com/san-pham/keo-cat-ton-mui-cong-trai-toptul-sbac0125-can-do-248mm.html,0
Kéo cắt tôn,"Kéo cắt tôn mũi thẳng Stanley 14-563-22 10""/250mm cán vàng",https://super-mro.com/san-pham/keo-cat-ton-mui-thang-stanley-14-563-22-10--250mm--can-vang.html,0
Kéo cắt tôn,"Kéo cắt tôn Stanley 14-556-22 10""/250mm",https://super-mro.com/san-pham/keo-cat-ton-stanley-14-556-22-10--250mm.html,0
Kéo cắt tôn,"Kéo cắt tôn mũi cong phải Stanley 14-564-22 10""/250mm cán xanh",https://super-mro.com/san-pham/keo-cat-ton-mui-cong-phai-stanley-14-564-22-10--250mm-can-xanh.html,0
Kéo cắt tôn,"Kéo cắt tôn mũi cong trái Stanley 14-562-22 10""/250mm cán đỏ",https://super-mro.com/san-pham/keo-cat-ton-mui-cong-trai-stanley-14-562-22-10--254mm--can-do.html,0
Kéo cắt tôn,"Kéo cắt tôn mỏ dài Stanley 14-165 12""/300mm",https://super-mro.com/san-pham/keo-cat-ton-mo-dai-stanley-14-165-12--300mm.html,0
Kéo cắt tôn,"Kéo cắt tôn kiểu Mỹ Asaki AK-0073 8""/200mm",https://super-mro.com/san-pham/keo-cat-ton-kieu-my-asaki-ak-0073-8200mm.html,0
Kéo cắt tôn,"Kéo cắt tôn kiểu Mỹ Asaki AK-0331 12""/300mm",https://super-mro.com/san-pham/t4111-keo-cat-ton-kieu-my-asaki-ak-0331-12inch-300mm.html,0
Kéo cắt tôn,"Kéo cắt tôn kiểu Mỹ Asaki AK-0074 14""/350mm",https://super-mro.com/san-pham/t4107-keo-cat-ton-kieu-my-asaki-ak-0074-14inch-350mm.html,0
Kéo cắt tôn,"Kéo cắt tôn (phải) Asaki AK-0168 10""/250mm",https://super-mro.com/san-pham/t4116-keo-cat-ton-phai-asaki-ak-0168-10inch-250mm.html,0
Kéo cắt tôn,"Kéo cắt tôn (trái) Asaki AK-0167 10""/250mm",https://super-mro.com/san-pham/t4115-keo-cat-ton-trai-asaki-ak-0167-10inch-250mm.html,0
Kéo cắt tôn,"Kéo cắt tôn mỏ dài Stanley 14-166 14""/350mm",https://super-mro.com/san-pham/keo-cat-ton-mo-dai-stanley-14-166-14--350mm.html,0
Kéo cắt tôn,"Kéo cắt tôn mũi thẳng Toptul SBAC0325 10""/250mm cán vàng",https://super-mro.com/san-pham/keo-cat-ton-mui-thang-toptul-sbac0325-can-vang-248mm.html,0
Kéo cắt tôn,"Kéo cắt tôn mũi cong phải Toptul SBAC0225 10""/250mm cán xanh",https://super-mro.com/san-pham/keo-cat-ton-mui-cong-phai-toptul-sbac0225-can-xanh-248mm.html,0
Kéo cắt tôn,"Kéo cắt tôn Stanley 14-164 10""/250mm",https://super-mro.com/san-pham/keo-cat-ton-stanley-14-164-10250mm.html,0
Kéo cắt tôn,"Kéo cắt tôn Stanley 14-163 8""/200mm",https://super-mro.com/san-pham/keo-cat-ton-stanley-14-163-8--200mm.html,0
Kéo cắt tôn,"Kéo cắt tôn Stanley 14-569-22 7""/180mm",https://super-mro.com/san-pham/keo-cat-ton-stanley-14-569-22-7--180mm.html,0
Kéo cắt tôn,"Kéo cắt tôn Stanley 14-558-22 12""/300mm",https://super-mro.com/san-pham/keo-cat-ton-stanley-14-558-22-12--300mm.html,0
Kéo cắt tôn,"Kéo cắt tôn mũi thẳng Sata 93103 10""/250mm cán dày",https://super-mro.com/san-pham/keo-cat-ton-mui-thang-sata-93103-can-day-10.html,0
Kéo cắt tôn,Kéo cắt tôn phải Toptul SBAD0124 240mm,https://super-mro.com/san-pham/keo-cat-ton-toptul-sbad0124-240mm.html,0
Kéo cắt tôn,Kéo cắt tôn (phải) Toptul SBAD0224 240mm,https://super-mro.com/san-pham/keo-cat-ton-cat-phai-toptul-sbad0224-240mm.html,0
Kéo cắt tôn,"Kéo cắt tôn thẳng Toptul SBAE0808 8""/200mm",https://super-mro.com/san-pham/keo-cat-ton-thang-toptul-sbae0808-200mm.html,0
Kéo cắt tôn,"Kéo cắt kim loại (thẳng) Toptul SBAE1010 10""/250mm",https://super-mro.com/san-pham/keo-cat-kim-loai-thang-toptul-sbae1010-10-254mm.html,0
Kéo cắt tôn,"Kéo cắt kim loại (thẳng) Toptul SBAE1212 12""/305mm",https://super-mro.com/san-pham/keo-cat-kim-loai-thang-toptul-sbae1212-12-305mm.html,0
Kéo cắt tôn,Kéo cắt tôn mũi bulldog Makita B-65822,https://super-mro.com/san-pham/keo-cat-ton-mui-bulldog-makita-b-65822.html,0
Kéo cắt tôn,Kéo cắt tôn mũi cắt bên phải Makita B-65816,https://super-mro.com/san-pham/keo-cat-ton-mui-cat-ben-phai-makita-b-65816.html,0
Kéo cắt tôn,Kéo cắt tôn mũi cắt bên trái Makita B-65800,https://super-mro.com/san-pham/keo-cat-ton-mui-cat-ben-trai-makita-b-65800.html,0
Kéo cắt tôn,Kéo cắt tôn mũi cắt thẳng Makita B-65791,https://super-mro.com/san-pham/keo-cat-ton-mui-cat-thang-makita-b-65791.html,0
Kéo cắt tôn,"Kéo cắt tôn mũi cong trái SATA 93101 10""/250mm",https://super-mro.com/san-pham/keo-cat-ton-mui-cong-trai-sata-93101-10-250mm.html,0
Kéo cắt tôn,"Kéo cắt tôn mũi cong phải SATA 93102 10""/250mm",https://super-mro.com/san-pham/keo-cat-ton-mui-cong-phai-sata-93102-10-250mm.html,0
Kéo cắt tôn,"Kéo cắt tôn SATA 93302 8""/205mm",https://super-mro.com/san-pham/keo-cat-ton-sata-93302-8-205mm.html,0
Kéo cắt tôn,"Kéo cắt tôn SATA 93303 10""/254mm",https://super-mro.com/san-pham/keo-cat-ton-sata-93303-10-254mm.html,0
Kéo cắt tôn,"Kéo cắt tôn SATA 93304 12""/305mm",https://super-mro.com/san-pham/keo-cat-ton-sata-93304-12-305mm.html,0
Kéo cắt tôn,"Kéo cắt tôn SATA 93305 14""/355mm",https://super-mro.com/san-pham/keo-cat-ton-sata-93305-14-355mm.html,0
Kéo cắt tôn,Kéo cắt tôn bên phải Yato YT-1916,https://super-mro.com/san-pham/keo-cat-ton-ben-phai-yato-yt-1916.html,0
Kéo cắt tôn,Kéo cắt tôn Yato YT-1923 230mm,https://super-mro.com/san-pham/keo-cat-ton-yato-yt-1923-230mm.html,0
Kéo cắt tôn,Kéo cắt tôn thẳng Yato YT-1962,https://super-mro.com/san-pham/keo-cat-ton-thang-yato-yt-1962.html,0
Kéo cắt tôn,Kìm cắt tôn bên phải Yato YT-1902,https://super-mro.com/san-pham/kim-cat-ton-ben-phai-yato-yt-1902.html,0
Kéo cắt tôn,Kìm cắt tôn kiểu Mỹ Yato YT-1971 205mm,https://super-mro.com/san-pham/kim-cat-ton-kieu-my-yato-yt-1971-205mm.html,0
Kéo cắt tôn,Kéo cắt tôn bên trái Yato YT-1960,https://super-mro.com/san-pham/keo-cat-ton-ben-trai-yato-yt-1960.html,0
Kéo cắt tôn,Kéo cắt tôn Yato YT-1964 260mm,https://super-mro.com/san-pham/keo-cat-ton-yato-yt-1964-260mm.html,0
Kéo cắt tôn,Kìm cắt tôn kiểu Mỹ Yato YT-1973 310mm,https://super-mro.com/san-pham/kim-cat-ton-kieu-my-yato-yt-1973-310mm.html,0
Kéo cắt tôn,Kéo cắt tôn mũi thẳng Yato YT-1912,https://super-mro.com/san-pham/keo-cat-ton-mui-thang-yato-yt-1912.html,0
Kéo cắt tôn,Kéo cắt tôn Yato YT-1963 205mm,https://super-mro.com/san-pham/keo-cat-ton-yato-yt-1963-205mm.html,0
Kéo cắt tôn,Kéo cắt tôn bên trái Yato YT-1910,https://super-mro.com/san-pham/keo-cat-ton-ben-trai-yato-yt-1910.html,0
Kéo cắt tôn,Kìm cắt tôn kiểu Mỹ Yato YT-1972 260mm,https://super-mro.com/san-pham/kim-cat-ton-kieu-my-yato-yt-1972-260mm.html,0
Kéo cắt tôn,Kéo cắt tôn bên phải Yato YT-1911,https://super-mro.com/san-pham/keo-cat-ton-ben-phai-yato-yt-1911.html,0
Kéo cắt tôn,Kéo cắt tôn mũi thẳng Yato YT-1925 225mm,https://super-mro.com/san-pham/keo-cat-ton-mui-thang-yato-yt-1925-225mm.html,0
Kéo cắt tôn,Kéo cắt tôn Yato YT-1965 300mm,https://super-mro.com/san-pham/keo-cat-ton-yato-yt-1965-300mm.html,0
Kéo cắt tôn,Kéo cắt tôn Yato YT-1922 290mm,https://super-mro.com/san-pham/keo-cat-ton-yato-yt-1922-290mm.html,0
Kéo cắt tôn,Kéo cắt tôn bên phải Yato YT-1961,https://super-mro.com/san-pham/keo-cat-ton-ben-phai-yato-yt-1961.html,0
Kéo cắt tôn,Kìm cắt tôn kiểu Đức Yato YT-1970 260mm,https://super-mro.com/san-pham/kim-cat-ton-kieu-duc-yato-yt-1970-260mm.html,0
