category_name,name,url,status
Máy thổi bụi,Máy thổi khí DEWALT DWB6800-B1,https://super-mro.com/san-pham/may-thoi-khi-dewalt-dwb6800-b1.html,0
Máy thổi bụi,Máy thổi bụi Bosch GBL 620,https://super-mro.com/san-pham/1y260-may-thoi-bui-bosch-gbl-620.html,0
Máy thổi bụi,Máy thổi bụi Bosch GBL 82-270,https://super-mro.com/san-pham/hwk38-may-thoi-bosch-gbl-82-270.html,0
Máy thổi bụi,Máy thổi bụi dùng pin Bosch GBL 18V-Li (Solo),https://super-mro.com/san-pham/1y308-may-thoi-khi-dung-pin-bosch-gbl-18v-li-solo.html,0
Máy thổi bụi,Máy thổi bụi Stanley STPT600-B1,https://super-mro.com/san-pham/1l444-may-thoi-bui-stanley-stpt600-b1.html,0
Máy thổi bụi,Máy Thổi Bụi Makita Ub1103,https://super-mro.com/san-pham/1q742-may-thoi-gio-makita-ub1103.html,0
Máy thổi bụi,Máy Thổi Dùng Pin 18V Makita Dub185Rt,https://super-mro.com/san-pham/1a8519-may-thoi-dung-pin-18v-makita-dub185rt.html,0
Máy thổi bụi,Máy Thổi Dùng Pin 18V Makita Dub185Z,https://super-mro.com/san-pham/1a8662-may-thoi-dung-pin-18v-makita-dub185z.html,0
Máy thổi bụi,Máy Thổi Bụi Makita MT M4000B,https://super-mro.com/san-pham/1a8429-may-thoi-makita-m4000b.html,0
Máy thổi bụi,Máy Thổi Bụi Makita MT M4001B,https://super-mro.com/san-pham/1a8432-may-thoi-makita-m4001b.html,0
Máy thổi bụi,Máy thổi bụi Makita MT401 (Ngừng cung cấp),https://super-mro.com/san-pham/hu661-may-thoi-makita-mt401.html,0
Máy thổi bụi,Máy Thổi Dùng Pin 12V Max Makita Ub100Dz,https://super-mro.com/san-pham/1a8522-may-thoi-dung-pin-12v-max-makita-ub100dz.html,0
Máy thổi bụi,Máy hút bụi khô ướt Milwaukee M12 FVCL-0,https://super-mro.com/san-pham/may-hut-bui-kho-uot-milwaukee-m12-fvcl-0.html,0
Máy thổi bụi,Máy thổi Milwaukee M12 BBL-0,https://super-mro.com/san-pham/may-thoi-milwaukee-m12-bbl-0.html,0
Máy thổi bụi,Máy thổi bụi Milwaukee M18 BBL-0,https://super-mro.com/san-pham/may-thoi-bui-milwaukee-m18-bbl-0.html,0
Máy thổi bụi,Thân máy thổi bụi Milwaukee M18 FBL-0 18V,https://super-mro.com/san-pham/may-thoi-bui-milwaukee-m18-fbl-0.html,0
Máy thổi bụi,Máy thổi bụi dùng pin DCA adqf28bk 18v/4.0ahx2,https://super-mro.com/san-pham/may-thoi-bui-dung-pin-dca-adqf28bk-18v-4-0ahx2.html,0
Máy thổi bụi,Thân máy thổi bụi dùng pin DCA adqf28z 18v,https://super-mro.com/san-pham/than-may-thoi-bui-dung-pin-dca-adqf28z-than-may-18v-4-0ahx2.html,0
Máy thổi bụi,Máy thổi bụi DCA aqf25 480w,https://super-mro.com/san-pham/may-thoi-bui-dca-aqf25-480w.html,0
Máy thổi bụi,Máy thổi bụi DCA aqf32 680w,https://super-mro.com/san-pham/may-thoi-bui-dca-aqf32-680w.html,0
Máy thổi bụi,Máy thổi bụi Dongcheng DQF32,https://super-mro.com/san-pham/may-thoi-bui-dongcheng-dqf32.html,0
Máy thổi bụi,Máy Thổi Dùng Pin Makita As001Gz01,https://super-mro.com/san-pham/may-thoi-dung-pin-makita-as001gz01.html,0
Máy thổi bụi,Máy Thổi Gió Chạy Xăng Makita Eb7660Th,https://super-mro.com/san-pham/may-thoi-gio-chay-xang-makita-eb7660th.html,0
Máy thổi bụi,Máy thổi đeo vai dùng pin Makita UB002CZ01 18V,https://super-mro.com/san-pham/may-thoi-deo-vai-dung-pin-makita-ub002cz01-bo-cap-nguon-bl-18vx2.html,0
Máy thổi bụi,Đã xóa 1865,https://super-mro.com/san-pham/da-xoa-1865.html,0
Máy thổi bụi,Đã xóa 1894,https://super-mro.com/san-pham/da-xoa-1894.html,0
Máy thổi bụi,Đã xóa 1895,https://super-mro.com/san-pham/da-xoa-1895.html,0
Máy thổi bụi,Đã xóa 1896,https://super-mro.com/san-pham/da-xoa-1896.html,0
Máy thổi bụi,Đã xóa 1897,https://super-mro.com/san-pham/da-xoa-1897.html,0
Máy thổi bụi,Đã xóa 1906,https://super-mro.com/san-pham/da-xoa-1906.html,0
Máy thổi bụi,Đã xóa 1907,https://super-mro.com/san-pham/da-xoa-1907.html,0
Máy thổi bụi,Đầu nối ống thổi góc trên cao dub362 363 Makita 191J13-3,https://super-mro.com/san-pham/dau-noi-ong-thoi-goc-tren-cao-dub362-363-makita-191j13-3.html,0
Máy thổi bụi,Đầu thổi chỗ hẹp as001g Makita 191X11-1,https://super-mro.com/san-pham/dau-thoi-cho-hep-as001g-makita-191x11-1.html,0
Máy thổi bụi,Đầu thổi đa năng as001g Makita 191X21-8,https://super-mro.com/san-pham/dau-thoi-da-nang-as001g-makita-191x21-8.html,0
Máy thổi bụi,Đầu thổi dẹp ub001g Makita 197889-6,https://super-mro.com/san-pham/dau-thoi-dep-ub001g-makita-197889-6.html,0
Máy thổi bụi,Đầu thổi khe mềm xanh Makita 140J64-3,https://super-mro.com/san-pham/dau-thoi-khe-mem-xanh-makita-140j64-3.html,0
Máy thổi bụi,Đầu thổi quạt as001g Makita 191X15-3,https://super-mro.com/san-pham/dau-thoi-quat-as001g-makita-191x15-3.html,0
Máy thổi bụi,Đầu thổi rộng as001g Makita 191X19-5,https://super-mro.com/san-pham/dau-thoi-rong-as001g-makita-191x19-5.html,0
Máy thổi bụi,Máy thổi bụi dùng pin Makita DAS180Z 18V,https://super-mro.com/san-pham/may-thoi-bui-dung-pin-makita-das180z-18v.html,0
Máy thổi bụi,Máy thổi dùng pin chỉ dùng với bộ cấp nguồn Makita UB003CZ,https://super-mro.com/san-pham/may-thoi-dung-pin-chi-dung-voi-bo-cap-nguon-makita-ub003cz.html,0
Máy thổi bụi,Máy thổi Bosch GBL 650 (06019M40K0),https://super-mro.com/san-pham/may-thoi-bosch-gbl-650-06019m40k0.html,0
Máy thổi bụi,"Máy thổi khô thảm, sàn DEWALT DXAM2250 130W",https://super-mro.com/san-pham/may-thoi-kho-tham-san-dewalt-dxam2250-130w.html,0
Máy thổi bụi,Máy hút bụi - thổi khí sử dụng pin 36V (18Vx2) Yato YT-85175 1300W,https://super-mro.com/san-pham/may-hut-bui-thoi-khi-su-dung-pin-36v-18vx2-yato-yt-85175-1300w.html,0
Máy thổi bụi,Máy thổi bụi cầm tay 600W Yato YT-85170,https://super-mro.com/san-pham/may-thoi-bui-cam-tay-600w-yato-yt-85170.html,0
Máy thổi bụi,Máy thổi bụi cầm tay 600W Yato YT-85170BS,https://super-mro.com/san-pham/may-thoi-bui-cam-tay-600w-yato-yt-85170bs.html,0
Máy thổi bụi,Máy thổi dùng pin (chỉ dùng chung với bộcấp nguồn/bl) Makita UB004CZ,https://super-mro.com/san-pham/may-thoi-dung-pin-chi-dung-chung-voi-bocap-nguon-bl-makita-ub004cz.html,0
Máy thổi bụi,Máy thổi hơi cầm tay Black&Decker BDB600-B1 600W,https://super-mro.com/san-pham/may-thoi-hoi-cam-tay-black-decker-bdb600-b1-600w.html,0
Máy thổi bụi,Máy thổi hơi cầm tay Dewalt DCM562p2 18V,https://super-mro.com/san-pham/may-thoi-hoi-cam-tay-dewalt-dcm562p2-18v.html,0
Máy thổi bụi,Máy thổi hơi cầm tay Dewalt DCMBA572N-KR 54/60V,https://super-mro.com/san-pham/may-thoi-hoi-cam-tay-dewalt-dcmba572n-kr-54-60v.html,0
Máy thổi bụi,Máy thổi hơi cầm tay Dewalt DCMBA572T1 54/60V,https://super-mro.com/san-pham/may-thoi-hoi-cam-tay-dewalt-dcmba572t1-54-60v.html,0
Máy thổi bụi,Máy thổi hơi cầm tay Dewalt DCMBA572X1 54/60V,https://super-mro.com/san-pham/may-thoi-hoi-cam-tay-dewalt-dcmba572x1-54-60v.html,0
Máy thổi bụi,Máy thổi hơi cầm tay Dewalt DCM562D2 18V,https://super-mro.com/san-pham/may-thoi-hoi-cam-tay-dewalt-dcm562d2-18v.html,0
Máy thổi bụi,Máy thổi hơi cầm tay Dewalt DCM562M2 18V,https://super-mro.com/san-pham/may-thoi-hoi-cam-tay-dewalt-dcm562m2-18v.html,0
Máy thổi bụi,Máy thổi hơi cầm tay Dewalt DCM562P1 18V,https://super-mro.com/san-pham/may-thoi-hoi-cam-tay-dewalt-dcm562p1-18v.html,0
Máy thổi bụi,Máy thổi hơi cầm tay Dewalt DCE100N-KR 18V,https://super-mro.com/san-pham/may-thoi-hoi-cam-tay-dewalt-dce100n-kr-18v.html,0
Máy thổi bụi,Máy thổi khí dùng pin Li-ion DCK KDQF32(TYPE BM) 20V,https://super-mro.com/san-pham/may-thoi-khi-dung-pin-li-ion-dck-kdqf32-type-bm-20v.html,0
Máy thổi bụi,Thân máy thổi khí dùng pin Li-ion DCK KDQF32(TYPE Z) 20V,https://super-mro.com/san-pham/than-may-thoi-khi-dung-pin-li-ion-dck-kdqf32-type-z-20v.html,0
Máy thổi bụi,Máy thổi khí DCK KQF32 680W,https://super-mro.com/san-pham/may-thoi-khi-dck-kqf32-680w.html,0
