category_name,name,url,status
Máy thổi lá,Máy Thổi Dùng Pin Makita Dub184Z Bl 18V,https://super-mro.com/san-pham/may-thoi-dung-pin-makita-dub184z-bl-18v.html,0
Máy thổi lá,Máy Thổi Dùng Pin Makita Dub363Zv Bl 18Vx2,https://super-mro.com/san-pham/may-thoi-dung-pin-makita-dub363zv-bl-18vx2.html,0
Máy thổi lá,Máy Thổi Lá Chạy Xăng Makita Bhx2500 24.5Ml/4 Thì,https://super-mro.com/san-pham/1q756-may-thoi-chay-xang-makita-bhx2500-24-5ml-4-thi.html,0
Máy thổi lá,Máy Thổi Dùng Pin Ống Thổi Sân Vườn 18V Makita Dub186Rt,https://super-mro.com/san-pham/1a8528-may-thoi-dung-pin-ong-thoi-san-vuon-18v-makita-dub186rt.html,0
Máy thổi lá,Máy Thổi Dùng Pin Ống Thổi Sân Vườn 18V Makita Dub186Z,https://super-mro.com/san-pham/1a8663-may-thoi-dung-pin-ong-thoi-san-vuon-18v-makita-dub186z.html,0
Máy thổi lá,Máy Thổi Dùng Pin Bl 18Vx2 Makita Dub362Z,https://super-mro.com/san-pham/1q637-may-thoi-dung-pin-bl-18vx2-makita-dub362z.html,0
Máy thổi lá,Máy Thổi Lá Chạy Xăng Thì Makita Eb5300Th 52.5Ml/4,https://super-mro.com/san-pham/1a8676-may-thoi-chay-xang-thi-makita-eb5300th-52-5ml-4.html,0
Máy thổi lá,Máy Thổi Dùng Pin Bộ Cấp Nguồn/Bl 18Vx2 Makita Ub001Cz,https://super-mro.com/san-pham/1a8491-may-thoi-dung-pin-bo-cap-nguon-bl-18vx2-makita-ub001cz.html,0
Máy thổi lá,Máy Thổi Dùng Pin Bl 40V Max Makita Ub001Gz,https://super-mro.com/san-pham/1a8743-may-thoi-dung-pin-bl-40v-max-makita-ub001gz.html,0
Máy thổi lá,Máy Thổi Dùng Pin Ống Thổi Sân Vườn 12V Max Makita Ub101Dz,https://super-mro.com/san-pham/1a8480-may-thoi-dung-pin-ong-thoi-san-vuon-12v-max-makita-ub101dz.html,0
Máy thổi lá,Thân máy thổi bụi lá dùng pin DEWALT DCM562N-KR 18V,https://super-mro.com/san-pham/than-may-thoi-bui-la-dung-pin-dewalt-dcm562n-kr-18v.html,0
