category_name,name,url,status
Máy bào,Máy bào DEWALT D26676-B1,https://super-mro.com/san-pham/may-bao-dewalt-d26676-b1.html,0
Máy bào,Máy Bào Dùng Pin Makita Dkp180Z 18V,https://super-mro.com/san-pham/may-bao-dung-pin-makita-dkp180z-18v.html,0
Máy bào,Máy Bào Dùng Pin Makita Dkp181Z Aws/Bl 18V,https://super-mro.com/san-pham/may-bao-dung-pin-makita-dkp181z-aws-bl-18v.html,0
Máy bào,Máy Bào Dùng Pin Makita Dkp181Zu Aws/Bl 18V,https://super-mro.com/san-pham/may-bao-dung-pin-makita-dkp181zu-aws-bl-18v.html,0
Máy bào,Máy Bào Makita MT M1901B 82mm,https://super-mro.com/san-pham/may-bao-makita-m1901b-82mm.html,0
Máy bào,Máy Bào Bê Tông Makita Pc5010C 125Mm,https://super-mro.com/san-pham/may-bao-be-tong-makita-pc5010c-125mm.html,0
Máy bào,Máy bào Bosch GHO 6500 650W 06015960K0,https://super-mro.com/san-pham/1f664-may-bao-bosch-gho-6500-650w-06015960k0.html,0
Máy bào,Máy bào Stanley STEL630-B1,https://super-mro.com/san-pham/1l442-may-bao-stanley-stel630-b1.html,0
Máy bào,Máy Bào 155Mm Makita 1805N,https://super-mro.com/san-pham/1z021-may-bao-155mm-makita-1805n.html,0
Máy bào,Máy Bào 110Mm Makita 1911B,https://super-mro.com/san-pham/1z019-may-bao-110mm-makita-1911b.html,0
Máy bào,Máy bào bàn Makita 2012NB 304mm,https://super-mro.com/san-pham/1z022-may-bao-304mm-makita-2012nb.html,0
Máy bào,Máy Bào Makita Kp0800X 82Mm,https://super-mro.com/san-pham/1z017-may-bao-makita-kp0800x-82mm.html,0
Máy bào,Máy Bào Makita MT M1100B 82Mm,https://super-mro.com/san-pham/1a8481-may-bao-makita-m1100b-82mm.html,0
Máy bào,Máy Bào Makita MT M1902B 82Mm,https://super-mro.com/san-pham/1a8478-may-bao-makita-m1902b-82mm.html,0
Máy bào,Máy Bào Makita MT111 82mm (Ngừng cung cấp),https://super-mro.com/san-pham/1a8708-may-bao-makita-mt111-82mm.html,0
Máy bào,Máy Bào Makita MT192 82mm (Ngừng cung cấp),https://super-mro.com/san-pham/1a8709-may-bao-makita-mt192-82mm.html,0
Máy bào,Máy Bào Makita N1900B 82Mm,https://super-mro.com/san-pham/1z018-may-bao-makita-n1900b-82mm.html,0
Máy bào,Máy bào Milwaukee M18 BP-0,https://super-mro.com/san-pham/may-bao-milwaukee-m18-bp-0.html,0
Máy bào,Máy bào điện DCA amb82 500w,https://super-mro.com/san-pham/may-bao-dien-dca-amb82-500w.html,0
Máy bào,Máy bào điện DCA amb02-82 500w,https://super-mro.com/san-pham/may-bao-dien-dca-amb02-82-500w.html,0
Máy bào,Máy bào điện DCA amb110 740w,https://super-mro.com/san-pham/may-bao-dien-dca-amb110-740w.html,0
Máy bào,Máy bào gỗ Dongcheng DMB82,https://super-mro.com/san-pham/may-bao-go-dongcheng-dmb82.html,0
Máy bào,Máy Bào Dùng Pin Makita Kp001Gz 82Mm 40V Max,https://super-mro.com/san-pham/may-bao-dung-pin-makita-kp001gz-82mm-40v-max.html,0
Máy bào,Máy bào MAKITA M1901B 82MM 11111,https://super-mro.com/san-pham/may-bao-makita-m1901b-82mm11111.html,0
Máy bào,Máy bào gỗ dùng pin 18V Bosch GHO 185-LI (SOLO) 06015B5080,https://super-mro.com/san-pham/may-bao-go-dung-pin-18v-bosch-gho-185-li-solo-06015b5080.html,0
Máy bào,Máy Bào Điện Yato YT-82140 1050W,https://super-mro.com/san-pham/may-bao-dien-yato-yt-82140-1050w.html,0
Máy bào,Máy bào bằng điện Yato YT-82141 810W,https://super-mro.com/san-pham/may-bao-bang-dien-yato-yt-82141-810w.html,0
Máy bào,Máy bào để bàn Stanley STP18-B1 1800W,https://super-mro.com/san-pham/may-bao-de-ban-stanley-stp18-b1-1800w.html,0
Máy bào,Máy bào để bàn Dewalt DW735-B1 15-AMP,https://super-mro.com/san-pham/may-bao-de-ban-dewalt-dw735-b1-15-amp.html,0
Máy bào,Máy bào cầm tay Dewalt DCP580M2 4Ah-18V,https://super-mro.com/san-pham/may-bao-cam-tay-dewalt-dcp580m2-4ah-18v.html,0
Máy bào,Máy bào cầm tay Dewalt DCP580N-KR 18V,https://super-mro.com/san-pham/may-bao-cam-tay-dewalt-dcp580n-kr-18v.html,0
Máy bào,Máy bào cầm tay Dewalt DCP580P2 5Ah-18V,https://super-mro.com/san-pham/may-bao-cam-tay-dewalt-dcp580p2-5ah-18v.html,0
Máy bào,Máy bào cầm tay Dewalt DCP580D2 2Ah-18V,https://super-mro.com/san-pham/may-bao-cam-tay-dewalt-dcp580d2-2ah-18v.html,0
Máy bào,Máy bào DCK KMB82 500W,https://super-mro.com/san-pham/may-bao-dck-kmb82-500w.html,0
