category_name,name,url,status
Mũ bảo hộ,Mũ bảo hộ lao động vặn Thùy Dương N20,https://super-mro.com/san-pham/mu-bao-ho-lao-dong-van-thuy-duong-n20.html,0
Mũ bảo hộ,Mũ bảo hiểm hàn tối tự động Yato YT-73921,https://super-mro.com/san-pham/mu-bao-hiem-han-toi-tu-dong-yato-yt-73921.html,0
Mũ bảo hộ,Mũ bảo hộ lao động màu xanh dương Yato YT-73982,https://super-mro.com/san-pham/mu-bao-ho-lao-dong-mau-xanh-duong-yato-yt-73982.html,0
Mũ bảo hộ,Mũ bảo hộ lao động màu cam Yato Yato YT-73984,https://super-mro.com/san-pham/mu-bao-ho-lao-dong-mau-cam-yato-yato-yt-73984.html,0
Mũ bảo hộ,Mũ bảo hộ lao động màu trắng Yato YT-73980,https://super-mro.com/san-pham/mu-bao-ho-lao-dong-mau-trang-yato-yt-73980.html,0
Mũ bảo hộ,Mũ bảo hộ lao động màu đỏ Yato YT-73981,https://super-mro.com/san-pham/mu-bao-ho-lao-dong-mau-do-yato-yt-73981.html,0
Mũ bảo hộ,Mũ bảo hộ lao động màu vàng Yato Yato YT-73983,https://super-mro.com/san-pham/mu-bao-ho-lao-dong-mau-vang-yato-yato-yt-73983.html,0
Mũ bảo hộ,Mũ bảo hộ lao động màu xanh lá cây Yato YT-73985,https://super-mro.com/san-pham/mu-bao-ho-lao-dong-mau-xanh-la-cay-yato-yt-73985.html,0
Mũ bảo hộ,Mũ bảo hộ Proguard HG2-WHG3RS,https://super-mro.com/san-pham/mu-bao-ho-proguard-hg2-whg3rs.html,0
Mũ bảo hộ,Mũ bảo hộ Proguard BC1-WHPL,https://super-mro.com/san-pham/mu-bao-ho-proguard-bc1-whpl.html,0
Mũ bảo hộ,Dây quai mũ Proguard PGCS-CE,https://super-mro.com/san-pham/day-quai-mu-proguard-pgcs-ce.html,0
Mũ bảo hộ,Đai và tấm che mặt Proguard BGVH/SI-2,https://super-mro.com/san-pham/dai-va-tam-che-mat-proguard-bgvh-si-2.html,0
Mũ bảo hộ,Tấm che mặt được làm bằng vật liệu Polycarbonate Proguard FC-48C-CE,https://super-mro.com/san-pham/tam-che-mat-duoc-lam-bang-vat-lieu-polycarbonate-proguard-fc-48c-ce.html,0
Mũ bảo hộ,Quai nón 3M 1990,https://super-mro.com/san-pham/quai-non-3m-1990.html,0
Mũ bảo hộ,Mũ bảo hộ vành rộng MSA V-Gard màu xanh lá 475370 Type I,https://super-mro.com/san-pham/mu-bao-ho-vanh-rong-msa-v-gard-mau-xanh-la-475370-type-i.html,0
Mũ bảo hộ,Mũ bảo hộ vành rộng MSA V-Gard màu đỏ 475371 Type I,https://super-mro.com/san-pham/mu-bao-ho-vanh-rong-msa-v-gard-mau-do-475371-type-i.html,0
Mũ bảo hộ,Dây quai mũ MSA 88128 10171104,https://super-mro.com/san-pham/day-quai-mu-msa-88128-10171104.html,0
Mũ bảo hộ,Dây quai mũ MSA 9100001,https://super-mro.com/san-pham/day-quai-mu-msa-9100001.html,0
Mũ bảo hộ,Mũ bảo hộ MSA V-Gard màu trắng 475358 Type I,https://super-mro.com/san-pham/mu-bao-ho-msa-v-gard-mau-trang-475358-type-i.html,0
Mũ bảo hộ,Mũ bảo hộ MSA V-Gard màu xanh 475359 Type I,https://super-mro.com/san-pham/mu-bao-ho-msa-v-gard-mau-xanh-475359-type-i.html,0
Mũ bảo hộ,Mũ bảo hộ MSA V-Gard màu vàng 475360 Type I,https://super-mro.com/san-pham/mu-bao-ho-msa-v-gard-mau-vang-475360-type-i.html,0
Mũ bảo hộ,Mũ bảo hộ MSA V-Gard màu xanh lá 475362 Type I,https://super-mro.com/san-pham/mu-bao-ho-msa-v-gard-mau-xanh-la-475362-type-i.html,0
Mũ bảo hộ,Mũ bảo hộ MSA V-Gard màu đỏ 475363 Type I,https://super-mro.com/san-pham/mu-bao-ho-msa-v-gard-mau-do-475363-type-i.html,0
Mũ bảo hộ,Mũ bảo hộ vành rộng MSA V-Gard màu trắng 475369 Type I,https://super-mro.com/san-pham/mu-bao-ho-vanh-rong-msa-v-gard-mau-trang-475369-type-i.html,0
