category_name,name,url,status
Nút nhấn,Nút nhấn chuông cỡ nhỏ Sino SCMBP2S 10A,https://super-mro.com/san-pham/nut-nhan-chuong-co-nho-sino-scmbp2s-10a.html,0
Nút nhấn,Nút nhấn chuông cỡ nhỏ Sino S18CCMBP2S 10A,https://super-mro.com/san-pham/nut-nhan-chuong-co-nho-sino-s18ccmbp2s-10a.html,0
Nút nhấn,Chuông dùng pin không dây 2 kiểu âm Sino F118 2 x 1.5V,https://super-mro.com/san-pham/chuong-dung-pin-khong-day-2-kieu-am-sino-f118-2-x-1-5v.html,0
Nút nhấn,Nút chuông lớn có dạ quang Sino S68DBP 10A,https://super-mro.com/san-pham/nut-chuong-lon-co-da-quang-sino-s68dbp-10a.html,0
Nút nhấn,Nút chuông phím lớn có dạ quang Sino S66DBP 10A,https://super-mro.com/san-pham/nut-chuong-phim-lon-co-da-quang-sino-s66dbp-10a.html,0
Nút nhấn,Nút nhấn chuông 3A Sino A96MBP2,https://super-mro.com/san-pham/nut-nhan-chuong-3a-sino-a96mbp2.html,0
Nút nhấn,Nút nhấn chuông cỡ trung Sino SCMBP2M 10A,https://super-mro.com/san-pham/nut-nhan-chuong-co-trung-sino-scmbp2m-10a.html,0
Nút nhấn,Nút nhấn chuông cỡ lớn Sino SCMBP2L 10A,https://super-mro.com/san-pham/nut-nhan-chuong-co-lon-sino-scmbp2l-10a.html,0
Nút nhấn,Nút nhấn chuông cỡ nhỏ 3A Sino S18HMBP2S,https://super-mro.com/san-pham/nut-nhan-chuong-co-nho-3a-sino-s18hmbp2s.html,0
Nút nhấn,Nút nhấn chuông cỡ trung Sino S18CCMBP2M 10A,https://super-mro.com/san-pham/nut-nhan-chuong-co-trung-sino-s18ccmbp2m-10a.html,0
Nút nhấn,Nút nhấn chuông cỡ lớn Sino S18CCMBP2L 10A,https://super-mro.com/san-pham/nut-nhan-chuong-co-lon-sino-s18ccmbp2l-10a.html,0
Nút nhấn,Nút nhấn chuông 3A Sino S668GMBP2,https://super-mro.com/san-pham/nut-nhan-chuong-3a-sino-s668gmbp2.html,0
Nút nhấn,Nút chuông lớn có dạ quang Sino S68DGBP 10A,https://super-mro.com/san-pham/nut-chuong-lon-co-da-quang-sino-s68dgbp-10a.html,0
Nút nhấn,Nút chuông phím lớn có dạ quang Sino S66DGBP 10A,https://super-mro.com/san-pham/nut-chuong-phim-lon-co-da-quang-sino-s66dgbp-10a.html,0
Nút nhấn,Chuông điện không dây 2 kiểu âm Sino F108 220V - 50Hz,https://super-mro.com/san-pham/chuong-dien-khong-day-2-kieu-am-sino-f108-220v-50hz.html,0
Nút nhấn,Chuông điện không dây bính boong Sino K108 220V - 50Hz,https://super-mro.com/san-pham/chuong-dien-khong-day-binh-boong-sino-k108-220v-50hz.html,0
Nút nhấn,Chuông điện có dây bính boong Sino 308 220V 50Hz 3.5W,https://super-mro.com/san-pham/chuong-dien-co-day-binh-boong-sino-308-220v-50hz-3-5w.html,0
Nút nhấn,Chuông điện có dây reng reng Sino 743 220V - 50Hz,https://super-mro.com/san-pham/chuong-dien-co-day-reng-reng-sino-743-220v-50hz.html,0
Nút nhấn,Chuông dùng pin không dây 2 kiểu âm Sino K118 4 x 1.5V,https://super-mro.com/san-pham/chuong-dung-pin-khong-day-2-kieu-am-sino-k118-4-x-1-5v.html,0
Nút nhấn,Nút nhấn chuông - kín nước Sino WBM 3A-250VAC~50Hz,https://super-mro.com/san-pham/nut-nhan-chuong-kin-nuoc-sino-wbm-3a-250vac-50hz.html,0
Nút nhấn,Chuông điện có dây bính boong Sino 703 220V - 50Hz,https://super-mro.com/san-pham/chuong-dien-co-day-binh-boong-sino-703-220v-50hz.html,0
Nút nhấn,Chuông điện không dây bính boong Sino S128 220V - 50Hz,https://super-mro.com/san-pham/chuong-dien-khong-day-binh-boong-sino-s128-220v-50hz.html,0
Nút nhấn,Nút ấn chuông MPE A267BP,https://super-mro.com/san-pham/nut-an-chuong-mpe-a267bp.html,0
Nút nhấn,Nút nhấn chuông MPE DBP,https://super-mro.com/san-pham/nut-nhan-chuong-mpe-dbp.html,0
Nút nhấn,"Chuông cửa không dây, không pin MPE DB2",https://super-mro.com/san-pham/chuong-của-khong-day-khong-pin-mpe-db2.html,0
Nút nhấn,"Nút nhấn chuông (Đèn báo không làm phiền, Đèn báo dọn phòng) MPE S7CDP",https://super-mro.com/san-pham/nut-nhan-chuong-den-bao-khong-lam-phien-den-bao-don-phong-mpe-s7cdp.html,0
Nút nhấn,Chuông điện MPE DB,https://super-mro.com/san-pham/chuong-diẹn-mpe-db.html,0
Nút nhấn,Nút nhấn chuông Panasonic WEG5401-7H,https://super-mro.com/san-pham/nut-nhan-chuong-panasonic-weg5401-7h.html,0
Nút nhấn,Nút nhấn chuông Panasonic WEVH5401-011 250VAC - 10A,https://super-mro.com/san-pham/nut-nhan-chuong-panasonic-wevh5401-011-250vac-10a.html,0
Nút nhấn,Nút nhấn chuông Panasonic WEVH5401-011MYZ 250VAC - 10A,https://super-mro.com/san-pham/nut-nhan-chuong-panasonic-wevh5401-011myz-250vac-10a.html,0
Nút nhấn,Nút nhấn chuông Panasonic WEVH5401-011MYH 250VAC - 10A,https://super-mro.com/san-pham/nut-nhan-chuong-panasonic-wevh5401-011myh-250vac-10a.html,0
Nút nhấn,Nút nhấn chuông Panasonic WNG5401W-7K 300VAC - 10A,https://super-mro.com/san-pham/nut-nhan-chuong-panasonic-wng5401w-7k-300vac-10a.html,0
Nút nhấn,"Nút nhấn chuông có đèn báo ""Không làm phiền"" Panasonic WMF936-VN mầu trắng",https://super-mro.com/san-pham/nut-nhan-chuong-co-den-bao-khong-lam-phien-panasonic-wmf936-vn-mau-trang.html,0
Nút nhấn,Nút nhấn chuông Panasonic WMF223-VN mầu trắng,https://super-mro.com/san-pham/nut-nhan-chuong-panasonic-wmf223-vn-mau-trang.html,0
Nút nhấn,Nút nhấn mở cửa Panasonic WMF224MYZ-VN mầu vàng ánh kim,https://super-mro.com/san-pham/nut-nhan-mo-cua-panasonic-wmf224myz-vn-mau-vang-anh-kim.html,0
Nút nhấn,"Nút nhấn chuông có đèn báo ""Không làm phiền"" Panasonic WMF936MYZ-VN mầu vàng ánh kim",https://super-mro.com/san-pham/nut-nhan-chuong-co-den-bao-khong-lam-phien-panasonic-wmf936myz-vn-mau-vang-anh-kim.html,0
Nút nhấn,Nút nhấn chuông Panasonic WMF223MYZ-VN mầu vàng ánh kim,https://super-mro.com/san-pham/nut-nhan-chuong-panasonic-wmf223myz-vn-mau-vang-anh-kim.html,0
Nút nhấn,Nút nhấn rèm cửa Panasonic WMF533-VN mầu trắng,https://super-mro.com/san-pham/nut-nhan-rem-cua-panasonic-wmf533-vn-mau-trang.html,0
Nút nhấn,Nút nhấn rèm cửa Panasonic WMF533MYZ-VN mầu vàng ánh kim,https://super-mro.com/san-pham/nut-nhan-rem-cua-panasonic-wmf533myz-vn-mau-vang-anh-kim.html,0
Nút nhấn,Nút nhấn mở cửa Panasonic WMF224-VN mầu trắng,https://super-mro.com/san-pham/nut-nhan-mo-cua-panasonic-wmf224-vn-mau-trang.html,0
Nút nhấn,"Nút nhấn chuông có đèn báo ""Không làm phiền"" Panasonic WMF936MYH-VN mầu xám ánh kim",https://super-mro.com/san-pham/nut-nhan-chuong-co-den-bao-khong-lam-phien-panasonic-wmf936myh-vn-mau-xam-anh-kim.html,0
Nút nhấn,Nút nhấn rèm cửa Panasonic WMF533MYH-VN mầu xám ánh kim,https://super-mro.com/san-pham/nut-nhan-rem-cua-panasonic-wmf533myh-vn-mau-xam-anh-kim.html,0
Nút nhấn,Nút nhấn chuông Panasonic WMF223MYH-VN mầu xám ánh kim,https://super-mro.com/san-pham/nut-nhan-chuong-panasonic-wmf223myh-vn-mau-xam-anh-kim.html,0
Nút nhấn,Nút nhấn mở cửa Panasonic WMF224MYH-VN mầu xám ánh kim,https://super-mro.com/san-pham/nut-nhan-mo-cua-panasonic-wmf224myh-vn-mau-xam-anh-kim.html,0
Nút nhấn,Nút nhấn chuông Panasonic WMT540108MYH-VN 220V - 10A mầu xám ánh kim,https://super-mro.com/san-pham/nut-nhan-chuong-panasonic-wmt540108myh-vn-220v-10a-mau-xam-anh-kim.html,0
Nút nhấn,Nút nhấn chuông Panasonic WMT540108MYZ-VN 220V - 10A mầu vàng ánh kim,https://super-mro.com/san-pham/nut-nhan-chuong-panasonic-wmt540108myz-vn-220v-10a-mau-vang-anh-kim.html,0
Nút nhấn,Chuông điện Panasonic EGG331,https://super-mro.com/san-pham/chuong-dien-panasonic-egg331.html,0
Nút nhấn,Chuông điện Panasonic EBG888,https://super-mro.com/san-pham/chuong-dien-panasonic-ebg888.html,0
Nút nhấn,Chuông báo cảm biến không dây kèm Chuông điện báo xa đến 150m Panasonic NJX379-156 110V - 240V/ Max 0.5W,https://super-mro.com/san-pham/chuong-bao-cam-bien-khong-day-kem-chuong-dien-bao-xa-den-150m-panasonic-njx379-156-110v-240v-max-0-5w.html,0
Nút nhấn,Nút chuông cảm ứng Panasonic NDT15,https://super-mro.com/san-pham/nut-chuong-cam-ung-panasonic-ndt15.html,0
Nút nhấn,Nút chuông không dùng pin Panasonic NDT153W,https://super-mro.com/san-pham/nut-chuong-khong-dung-pin-panasonic-ndt153w.html,0
Nút nhấn,Nút chuông không dùng pin Panasonic NDT153BK,https://super-mro.com/san-pham/nut-chuong-khong-dung-pin-panasonic-ndt153bk.html,0
Nút nhấn,Bộ Chuông điện không dây không dùng pin Panasonic ND153BK 110V - 240V/ Max 0.5W,https://super-mro.com/san-pham/bo-chuong-dien-khong-day-khong-dung-pin-panasonic-nd153bk-110v-240v-max-0-5w.html,0
Nút nhấn,Bộ Chuông điện không dây không dùng pin Panasonic ND153W 110V - 240V/ Max 0.5W,https://super-mro.com/san-pham/bo-chuong-dien-khong-day-khong-dung-pin-panasonic-nd153w-110v-240v-max-0-5w.html,0
Nút nhấn,"Chuông báo cảm biến không dây Panasonic NJX378 
DC 4.5V/ Max 0.5W","https://super-mro.com/san-pham/chuong-bao-cam-bien-khong-day-panasonic-njx378-
dc-4-5v-max-0-5w.html",0
Nút nhấn,Chuông điện không dây Panasonic ND156 110V - 220V/ Max 0.5W,https://super-mro.com/san-pham/chuong-dien-khong-day-panasonic-nd156-110v-220v-max-0-5w.html,0
Nút nhấn,Chuông điện không dây Panasonic ND157 110V - 220V/ Max 0.5W,https://super-mro.com/san-pham/chuong-dien-khong-day-panasonic-nd157-110v-220v-max-0-5w.html,0
