category_name,name,url,status
Rô to,"Rotor dùng cho máy khoan pin DCF885, hiệu Dewalt, mã hàng N110033",https://super-mro.com/san-pham/rotor-dung-cho-may-khoan-pin-dcf885-hieu-dewalt-ma-hang-n110033.html,0
Rô to,"Rotor nguyên bộ dùng cho máy khoan DWD022 hiệu Dewalt, mã hàng N034417",https://super-mro.com/san-pham/rotor-nguyen-bo-dung-cho-may-khoan-dwd022-hieu-dewalt-ma-hang-n034417.html,0
Rô to,"Rotor cho máy Dewalt, mã hàng N869188",https://super-mro.com/san-pham/rotor-cho-may-dewalt-ma-hang-n869188.html,0
Rô to,"Rotor nguyên bộ dùng cho máy cắt sắt D28730 Dewalt, N498636",https://super-mro.com/san-pham/rotor-nguyen-bo-dung-cho-may-cat-sat-d28730-dewalt-n498636.html,0
Rô to,"Rô to dùng cho máy khoan SHR263k, Stanley, N505287",https://super-mro.com/san-pham/ro-to-dung-cho-may-khoan-shr263k-stanley-n505287.html,0
Rô to,Rotor dùng cho máy cắt SSC22 Stanley N534363,https://super-mro.com/san-pham/rotor-dung-cho-may-cat-ssc22-stanley-n534363.html,0
Rô to,Rotor và quạt dùng cho máy Dewalt DW840 N024648,https://super-mro.com/san-pham/rotor-va-quat-dung-cho-may-dewalt-dw840-n024648.html,0
