category_name,name,url,status
Súng bấm ghim,Súng bắn ghim STANLEY TR250,https://super-mro.com/san-pham/sung-ban-ghim-stanley-tr250.html,0
Súng bấm ghim,Máy Bắn Ghim Dùng Hơi Makita At1022Az,https://super-mro.com/san-pham/1h105-may-ban-ghim-dung-hoi-makita-at1022az.html,0
Súng bấm ghim,Máy Bắn Ghim Dùng Hơi Makita At422Az,https://super-mro.com/san-pham/1h106-may-ban-ghim-dung-hoi-makita-at422az.html,0
Súng bấm ghim,Súng bắn gim dùng hơi DCA a02-p625 4-8bar,https://super-mro.com/san-pham/sung-ban-gim-dung-hoi-dca-a02-p625-4-8bar.html,0
Súng bấm ghim,Súng bấm ghim thùng carton Yato YT-7000 6-14mm,https://super-mro.com/san-pham/sung-bam-ghim-thung-carton-yato-yt-7000-6-14mm.html,0
Súng bấm ghim,Súng bấm ghim thùng carton Yato YT-7001 6-14mm,https://super-mro.com/san-pham/sung-bam-ghim-thung-carton-yato-yt-7001-6-14mm.html,0
Súng bấm ghim,Súng bắn ghim bằng tay Yato YT-70020,https://super-mro.com/san-pham/sung-ban-ghim-bang-tay-yato-yt-70020.html,0
Súng bấm ghim,Súng bắn ghim bằng tay Yato YT-70021,https://super-mro.com/san-pham/sung-ban-ghim-bang-tay-yato-yt-70021.html,0
Súng bấm ghim,Súng bấm ghim thùng carton Yato YT-7003 6-14mm,https://super-mro.com/san-pham/sung-bam-ghim-thung-carton-yato-yt-7003-6-14mm.html,0
Súng bấm ghim,Súng bắn gim dùng khí nén từ Yato YT-09201 6 -16mm 0.7mPa,https://super-mro.com/san-pham/sung-ban-gim-dung-khi-nen-tu-yato-yt-09201-6-16mm-0-7mpa.html,0
Súng bấm ghim,Súng bắn gim dùng khí nén từ Yato YT-09203 25-40mm 0.8mPa,https://super-mro.com/san-pham/sung-ban-gim-dung-khi-nen-tu-yato-yt-09203-25-40mm-0-8mpa.html,0
Súng bấm ghim,Bấm kim gim Stanley TR250,https://super-mro.com/san-pham/bam-kim-gim-stanley-tr250.html,0
Súng bấm ghim,Bấm kim gim Stanley TRA706T 3/8'',https://super-mro.com/san-pham/bam-kim-gim-stanley-tra706t-3-8.html,0
Súng bấm ghim,Bấm kim gim Stanley TRA709T 9/16-14mm,https://super-mro.com/san-pham/bam-kim-gim-stanley-tra709t-9-16-14mm.html,0
